{
  "schema": "web-vfx-runtime@2",
  "effectId": "node-0",
  "compilerVersion": "unity-vfx-compiler@0.2",
  "seed": 1686449335,
  "fixedDelta": 0.016666666666666666,
  "duration": 2,
  "looping": false,
  "resources": [
    {
      "id": "quarks_texture-5",
      "kind": "texture",
      "uri": "resources/quarks_texture-5.png",
      "colorSpace": "linear"
    },
    {
      "id": "quarks_texture-6",
      "kind": "texture",
      "uri": "resources/quarks_texture-6.png",
      "colorSpace": "linear"
    },
    {
      "id": "quarks_texture-8",
      "kind": "texture",
      "uri": "resources/quarks_texture-8.png",
      "colorSpace": "linear"
    },
    {
      "id": "quarks_texture-11",
      "kind": "texture",
      "uri": "resources/quarks_texture-11.png",
      "colorSpace": "linear"
    },
    {
      "id": "quarks_texture-13",
      "kind": "texture",
      "uri": "resources/quarks_texture-13.png",
      "colorSpace": "linear"
    },
    {
      "id": "quarks_texture-14",
      "kind": "texture",
      "uri": "resources/quarks_texture-14.png",
      "colorSpace": "linear"
    },
    {
      "id": "quarks_texture-16",
      "kind": "texture",
      "uri": "resources/quarks_texture-16.png",
      "colorSpace": "linear"
    },
    {
      "id": "quarks_texture-17",
      "kind": "texture",
      "uri": "resources/quarks_texture-17.png",
      "colorSpace": "linear"
    },
    {
      "id": "quarks_texture-18",
      "kind": "texture",
      "uri": "resources/quarks_texture-18.png",
      "colorSpace": "linear"
    },
    {
      "id": "quarks_texture-21",
      "kind": "texture",
      "uri": "resources/quarks_texture-21.png",
      "colorSpace": "linear"
    },
    {
      "id": "quarks_texture-23",
      "kind": "texture",
      "uri": "resources/quarks_texture-23.png",
      "colorSpace": "linear"
    },
    {
      "id": "quarks_texture-24",
      "kind": "texture",
      "uri": "resources/quarks_texture-24.png",
      "colorSpace": "linear"
    },
    {
      "id": "quarks_texture-26",
      "kind": "texture",
      "uri": "resources/quarks_texture-26.png",
      "colorSpace": "linear"
    },
    {
      "id": "quarks_geometry-28",
      "kind": "geometry",
      "uri": "embedded:quarks_geometry-28",
      "metadata": {
        "externalUri": "resources/quarks_geometry-28.geometry.json"
      }
    }
  ],
  "materials": [
    {
      "id": "quarks_material-9",
      "vertexShader": "",
      "fragmentShader": "",
      "textures": {
        "uMainMap": "quarks_texture-5"
      },
      "uniforms": {
        "uTint": [
          8.574187278747559,
          8.574187278747559,
          8.574187278747559,
          1
        ],
        "operations": [
          {
            "op": "sample-main",
            "texture": "quarks_texture-5",
            "uv": "particle-flipbook"
          },
          {
            "op": "coverage",
            "source": "red"
          },
          {
            "op": "vertex-color"
          },
          {
            "op": "tint"
          },
          {
            "op": "dissolve",
            "enabled": false
          },
          {
            "op": "soft-particle-depth",
            "enabled": true
          },
          {
            "op": "dynamic-alpha-clip",
            "source": "custom1.z",
            "scale": 1
          },
          {
            "op": "hdr-multiply"
          },
          {
            "op": "blend",
            "mode": "alpha"
          }
        ],
        "uUseMask": 0,
        "uUseSceneColor": 0,
        "uUseDissolve": 1
      },
      "renderState": {
        "blend": "alpha",
        "depthTest": true,
        "depthWrite": false,
        "cull": "none",
        "alphaTest": 0,
        "toneMapped": false
      }
    },
    {
      "id": "quarks_material-15",
      "vertexShader": "",
      "fragmentShader": "",
      "textures": {
        "uMainMap": "quarks_texture-11"
      },
      "uniforms": {
        "uTint": [
          8.574187278747559,
          8.574187278747559,
          8.574187278747559,
          1
        ],
        "operations": [
          {
            "op": "sample-main",
            "texture": "quarks_texture-11",
            "uv": "particle-flipbook"
          },
          {
            "op": "coverage",
            "source": "red"
          },
          {
            "op": "vertex-color"
          },
          {
            "op": "tint"
          },
          {
            "op": "dissolve",
            "enabled": false
          },
          {
            "op": "soft-particle-depth",
            "enabled": true
          },
          {
            "op": "hdr-multiply"
          },
          {
            "op": "blend",
            "mode": "alpha"
          }
        ],
        "uUseMask": 0,
        "uUseSceneColor": 0,
        "uUseDissolve": 1
      },
      "renderState": {
        "blend": "alpha",
        "depthTest": true,
        "depthWrite": false,
        "cull": "none",
        "alphaTest": 0,
        "toneMapped": false
      }
    },
    {
      "id": "quarks_material-19",
      "vertexShader": "",
      "fragmentShader": "",
      "textures": {
        "uMainMap": "quarks_texture-16"
      },
      "uniforms": {
        "uTint": [
          8.574187278747559,
          8.574187278747559,
          8.574187278747559,
          1
        ],
        "operations": [
          {
            "op": "sample-main",
            "texture": "quarks_texture-16",
            "uv": "particle-flipbook"
          },
          {
            "op": "coverage",
            "source": "red"
          },
          {
            "op": "vertex-color"
          },
          {
            "op": "tint"
          },
          {
            "op": "dissolve",
            "enabled": false
          },
          {
            "op": "soft-particle-depth",
            "enabled": true
          },
          {
            "op": "hdr-multiply"
          },
          {
            "op": "blend",
            "mode": "alpha"
          }
        ],
        "uUseMask": 0,
        "uUseSceneColor": 0,
        "uUseDissolve": 1
      },
      "renderState": {
        "blend": "alpha",
        "depthTest": true,
        "depthWrite": false,
        "cull": "none",
        "alphaTest": 0,
        "toneMapped": false
      }
    },
    {
      "id": "quarks_material-27",
      "vertexShader": "",
      "fragmentShader": "",
      "textures": {
        "uMainMap": "quarks_texture-21",
        "uMask": "quarks_texture-26"
      },
      "uniforms": {
        "uTint": [
          8.474189758300781,
          8.474189758300781,
          8.474189758300781,
          1
        ],
        "operations": [
          {
            "op": "sample-main",
            "texture": "quarks_texture-21",
            "uv": "particle-flipbook"
          },
          {
            "op": "coverage",
            "source": "red"
          },
          {
            "op": "vertex-color"
          },
          {
            "op": "tint"
          },
          {
            "op": "manual-graph-lowering",
            "id": "slash-screen@2",
            "sourceGraphHash": "cf675eab2cba896fd7a253ca2ecbca3e",
            "fidelity": "reviewed-manual",
            "requiresOracle": true
          },
          {
            "op": "mask"
          },
          {
            "op": "dissolve",
            "enabled": true
          },
          {
            "op": "soft-particle-depth",
            "enabled": true
          },
          {
            "op": "hdr-multiply"
          },
          {
            "op": "blend",
            "mode": "alpha"
          }
        ],
        "uUseMask": 1,
        "uUseSceneColor": 1,
        "uUseDissolve": 1
      },
      "renderState": {
        "blend": "alpha",
        "depthTest": true,
        "depthWrite": false,
        "cull": "none",
        "alphaTest": 0,
        "toneMapped": false
      }
    }
  ],
  "programs": [
    {
      "id": "node-0:FrameOverLife",
      "op": "FrameOverLife",
      "params": {
        "type": "FrameOverLife",
        "frame": {
          "type": "ConstantValue",
          "value": 0.5
        }
      }
    },
    {
      "id": "node-1:ColorOverLife",
      "op": "ColorOverLife",
      "params": {
        "type": "ColorOverLife",
        "color": {
          "type": "Gradient",
          "functions": [
            {
              "function": {
                "type": "ColorRange",
                "a": {
                  "r": 1,
                  "g": 1,
                  "b": 1,
                  "a": 1
                },
                "b": {
                  "r": 1,
                  "g": 1,
                  "b": 1,
                  "a": 1
                }
              },
              "start": 0
            },
            {
              "function": {
                "type": "ColorRange",
                "a": {
                  "r": 1,
                  "g": 1,
                  "b": 1,
                  "a": 1
                },
                "b": {
                  "r": 1,
                  "g": 1,
                  "b": 1,
                  "a": 0
                }
              },
              "start": 0.7852903008460999
            }
          ]
        }
      }
    },
    {
      "id": "node-1:SizeOverLife",
      "op": "SizeOverLife",
      "params": {
        "type": "SizeOverLife",
        "size": {
          "type": "PiecewiseBezier",
          "functions": [
            {
              "function": {
                "p0": 1,
                "p1": 1.4099191427230835,
                "p2": 0.6666666865348816,
                "p3": 0
              },
              "start": 0
            }
          ]
        }
      }
    },
    {
      "id": "node-2:ColorOverLife",
      "op": "ColorOverLife",
      "params": {
        "type": "ColorOverLife",
        "color": {
          "type": "Gradient",
          "functions": [
            {
              "function": {